{
    "protocol_version": 1,
    "application_id": "224065ac-4bc7-4ba4-a06d-8c8bca950c32",
    "lines": [
        "[2026-10-12 12:00:00] production.INFO: Application booted",
        "[2026-10-12 12:00:03] production.INFO: GET /health 200",
        "[2026-10-12 12:00:05] production.WARNING: Slow query detected",
        "[2026-10-12 12:00:09] production.INFO: Queue worker processed job"
    ],
    "truncated": false,
    "sampled_at": "1970-01-01T00:00:00Z"
}
